{
  "schema_version": "2.0.0",
  "session_id": "sess_l6_0001",
  "objective_id": "obj_l6_scene_plan",
  "created_at": "2026-02-06T04:46:04Z",
  "case_id": "case_sess_l6_0001",
  "style_preset": "true_crime_cinematic_pt_v2",
  "global_negative_constraints": [
    "explicit dismemberment details",
    "graphic torture description",
    "victim-blaming phrasing"
  ],
  "scenes": [
    {
      "scene_id": "scene_001",
      "beat_id": "beat_001",
      "duration_sec": 2.69,
      "narration_text": "E se a primeira versao estivesse incompleta?",
      "visual_goal": "Deliver immediate stop-scroll tension in first seconds.",
      "character_refs": [
        "person_victim"
      ],
      "location_ref": "location_primary",
      "continuity_state": {
        "scene_index": 1,
        "purpose": "hook"
      },
      "shot_spec": {
        "shot_size": "CLOSEUP",
        "camera_angle": "LOW_ANGLE",
        "camera_motion": "HANDHELD"
      },
      "action_emotion": {
        "action": "abrupt reveal of contradiction",
        "emotion": "shock"
      },
      "time_weather": {
        "time_of_day": "NIGHT",
        "weather": "CLOUDY"
      },
      "negative_constraints": [
        "explicit dismemberment details",
        "graphic torture description",
        "victim-blaming phrasing",
        "no explicit gore visuals",
        "avoid glorifying perpetrator"
      ],
      "visual_prompt": {
        "image_prompt": "true_crime_cinematic_pt_v2, Deliver immediate stop-scroll tension in first seconds. Narration cue: E se a primeira versao estivesse incompleta?. Shot: CLOSEUP LOW_ANGLE. Location: location_primary.",
        "video_prompt": "Animate investigative sequence with HANDHELD camera motion. Action: abrupt reveal of contradiction. Emotion: shock. Keep continuity with previous scene and respect policy constraints."
      },
      "source_refs": [
        "clm_001"
      ]
    },
    {
      "scene_id": "scene_002",
      "beat_id": "beat_002",
      "duration_sec": 3.46,
      "narration_text": "No Brasil, o caso de um taxista parecia simples.",
      "visual_goal": "Establish the case context and principal characters.",
      "character_refs": [
        "person_victim"
      ],
      "location_ref": "location_primary",
      "continuity_state": {
        "scene_index": 2,
        "purpose": "setup"
      },
      "shot_spec": {
        "shot_size": "WIDE",
        "camera_angle": "EYE_LEVEL",
        "camera_motion": "PAN"
      },
      "action_emotion": {
        "action": "establish people and place",
        "emotion": "unease"
      },
      "time_weather": {
        "time_of_day": "AFTERNOON",
        "weather": "CLEAR"
      },
      "negative_constraints": [
        "explicit dismemberment details",
        "graphic torture description",
        "victim-blaming phrasing",
        "no explicit gore visuals",
        "avoid glorifying perpetrator"
      ],
      "visual_prompt": {
        "image_prompt": "true_crime_cinematic_pt_v2, Establish the case context and principal characters. Narration cue: No Brasil, o caso de um taxista parecia simples.. Shot: WIDE EYE_LEVEL. Location: location_primary.",
        "video_prompt": "Animate investigative sequence with PAN camera motion. Action: establish people and place. Emotion: unease. Keep continuity with previous scene and respect policy constraints."
      },
      "source_refs": [
        "clm_001"
      ]
    },
    {
      "scene_id": "scene_003",
      "beat_id": "beat_003",
      "duration_sec": 3.85,
      "narration_text": "Registros e relatos mostraram uma contradicao na linha do tempo.",
      "visual_goal": "Increase curiosity with evidence-driven progression.",
      "character_refs": [
        "person_victim"
      ],
      "location_ref": "location_primary",
      "continuity_state": {
        "scene_index": 3,
        "purpose": "build"
      },
      "shot_spec": {
        "shot_size": "MEDIUM",
        "camera_angle": "EYE_LEVEL",
        "camera_motion": "TRACKING"
      },
      "action_emotion": {
        "action": "connect clues and timeline",
        "emotion": "suspense"
      },
      "time_weather": {
        "time_of_day": "SUNSET",
        "weather": "CLOUDY"
      },
      "negative_constraints": [
        "explicit dismemberment details",
        "graphic torture description",
        "victim-blaming phrasing",
        "no explicit gore visuals",
        "avoid glorifying perpetrator"
      ],
      "visual_prompt": {
        "image_prompt": "true_crime_cinematic_pt_v2, Increase curiosity with evidence-driven progression. Narration cue: Registros e relatos mostraram uma contradicao na linha do tempo.. Shot: MEDIUM EYE_LEVEL. Location: location_primary.",
        "video_prompt": "Animate investigative sequence with TRACKING camera motion. Action: connect clues and timeline. Emotion: suspense. Keep continuity with previous scene and respect policy constraints."
      },
      "source_refs": [
        "clm_001"
      ]
    },
    {
      "scene_id": "scene_004",
      "beat_id": "beat_004",
      "duration_sec": 3.08,
      "narration_text": "A evidencia final mudou a leitura do caso.",
      "visual_goal": "Resolve contradiction with clear investigative framing.",
      "character_refs": [
        "person_victim"
      ],
      "location_ref": "location_primary",
      "continuity_state": {
        "scene_index": 4,
        "purpose": "payoff"
      },
      "shot_spec": {
        "shot_size": "CLOSEUP",
        "camera_angle": "HIGH_ANGLE",
        "camera_motion": "DOLLY"
      },
      "action_emotion": {
        "action": "confirm decisive evidence",
        "emotion": "grim clarity"
      },
      "time_weather": {
        "time_of_day": "NIGHT",
        "weather": "CLOUDY"
      },
      "negative_constraints": [
        "explicit dismemberment details",
        "graphic torture description",
        "victim-blaming phrasing",
        "no explicit gore visuals",
        "avoid glorifying perpetrator"
      ],
      "visual_prompt": {
        "image_prompt": "true_crime_cinematic_pt_v2, Resolve contradiction with clear investigative framing. Narration cue: A evidencia final mudou a leitura do caso.. Shot: CLOSEUP HIGH_ANGLE. Location: location_primary.",
        "video_prompt": "Animate investigative sequence with DOLLY camera motion. Action: confirm decisive evidence. Emotion: grim clarity. Keep continuity with previous scene and respect policy constraints."
      },
      "source_refs": [
        "clm_001"
      ]
    },
    {
      "scene_id": "scene_005",
      "beat_id": "beat_005",
      "duration_sec": 3.46,
      "narration_text": "Reveja a primeira frase e perceba o que mudou.",
      "visual_goal": "Create replay curiosity by mirroring the opening beat.",
      "character_refs": [
        "person_victim"
      ],
      "location_ref": "location_primary",
      "continuity_state": {
        "scene_index": 5,
        "purpose": "loop"
      },
      "shot_spec": {
        "shot_size": "EXTREME_CLOSEUP",
        "camera_angle": "DUTCH",
        "camera_motion": "STATIC"
      },
      "action_emotion": {
        "action": "echo opening line",
        "emotion": "curiosity"
      },
      "time_weather": {
        "time_of_day": "NIGHT",
        "weather": "CLOUDY"
      },
      "negative_constraints": [
        "explicit dismemberment details",
        "graphic torture description",
        "victim-blaming phrasing",
        "no explicit gore visuals",
        "avoid glorifying perpetrator"
      ],
      "visual_prompt": {
        "image_prompt": "true_crime_cinematic_pt_v2, Create replay curiosity by mirroring the opening beat. Narration cue: Reveja a primeira frase e perceba o que mudou.. Shot: EXTREME_CLOSEUP DUTCH. Location: location_primary.",
        "video_prompt": "Animate investigative sequence with STATIC camera motion. Action: echo opening line. Emotion: curiosity. Keep continuity with previous scene and respect policy constraints."
      },
      "source_refs": [
        "clm_001"
      ]
    }
  ]
}
