{
  "schema_version": "2.0.0",
  "session_id": "sess_l6_0001",
  "objective_id": "obj_l6_scene_plan",
  "created_at": "2026-02-06T10:46:34Z",
  "case_id": "case_sess_l6_0001",
  "style_preset": "true_crime_cinematic_pt_v2",
  "global_negative_constraints": [
    "explicit dismemberment details",
    "graphic torture description",
    "victim-blaming phrasing"
  ],
  "scenes": [
    {
      "scene_id": "scene_001",
      "beat_id": "beat_001",
      "duration_sec": 2.69,
      "narration_text": "E se a primeira versao estivesse incompleta?",
      "visual_goal": "Deliver immediate stop-scroll tension in first seconds.",
      "character_refs": [
        "person_victim"
      ],
      "location_ref": "location_primary",
      "continuity_state": {
        "scene_index": 1,
        "purpose": "hook",
        "prompt_candidate_id": "scene_001_prompt_002",
        "prompt_strategy": "impact_focus",
        "prompt_revised": true
      },
      "shot_spec": {
        "shot_size": "CLOSEUP",
        "camera_angle": "LOW_ANGLE",
        "camera_motion": "HANDHELD"
      },
      "action_emotion": {
        "action": "abrupt reveal of contradiction",
        "emotion": "shock"
      },
      "time_weather": {
        "time_of_day": "NIGHT",
        "weather": "CLOUDY"
      },
      "negative_constraints": [
        "explicit dismemberment details",
        "graphic torture description",
        "victim-blaming phrasing",
        "no explicit gore visuals",
        "avoid glorifying perpetrator"
      ],
      "visual_prompt": {
        "image_prompt": "true_crime_cinematic_pt_v2, high-contrast dramatic frame for scene_001. Create immediate scroll-stop impact around: Deliver immediate stop-scroll tension in first seconds.. Narration phrase: E se a primeira versao estivesse incompleta?. Location: location_primary. Shot: CLOSEUP LOW_ANGLE. Character anchor: person_victim.",
        "video_prompt": "CameraMotion: HANDHELD. Action: abrupt reveal of contradiction. Emotion: shock. Start with a sharp visual reveal, then sustain suspense while preserving scene continuity."
      },
      "source_refs": [
        "clm_001"
      ]
    },
    {
      "scene_id": "scene_002",
      "beat_id": "beat_002",
      "duration_sec": 3.46,
      "narration_text": "No Brasil, o caso de um taxista parecia simples.",
      "visual_goal": "Establish the case context and principal characters.",
      "character_refs": [
        "person_victim"
      ],
      "location_ref": "location_primary",
      "continuity_state": {
        "scene_index": 2,
        "purpose": "setup",
        "prompt_candidate_id": "scene_002_prompt_002",
        "prompt_strategy": "impact_focus",
        "prompt_revised": true
      },
      "shot_spec": {
        "shot_size": "WIDE",
        "camera_angle": "EYE_LEVEL",
        "camera_motion": "PAN"
      },
      "action_emotion": {
        "action": "establish people and place",
        "emotion": "unease"
      },
      "time_weather": {
        "time_of_day": "AFTERNOON",
        "weather": "CLEAR"
      },
      "negative_constraints": [
        "explicit dismemberment details",
        "graphic torture description",
        "victim-blaming phrasing",
        "no explicit gore visuals",
        "avoid glorifying perpetrator"
      ],
      "visual_prompt": {
        "image_prompt": "true_crime_cinematic_pt_v2, high-contrast dramatic frame for scene_002. Create immediate scroll-stop impact around: Establish the case context and principal characters.. Narration phrase: No Brasil, o caso de um taxista parecia simples.. Location: location_primary. Shot: WIDE EYE_LEVEL. Character anchor: person_victim.",
        "video_prompt": "CameraMotion: PAN. Action: establish people and place. Emotion: unease. Start with a sharp visual reveal, then sustain suspense while preserving scene continuity."
      },
      "source_refs": [
        "clm_001"
      ]
    },
    {
      "scene_id": "scene_003",
      "beat_id": "beat_003",
      "duration_sec": 3.85,
      "narration_text": "Registros e relatos mostraram uma contradicao na linha do tempo.",
      "visual_goal": "Increase curiosity with evidence-driven progression.",
      "character_refs": [
        "person_victim"
      ],
      "location_ref": "location_primary",
      "continuity_state": {
        "scene_index": 3,
        "purpose": "build",
        "prompt_candidate_id": "scene_003_prompt_002",
        "prompt_strategy": "impact_focus",
        "prompt_revised": true
      },
      "shot_spec": {
        "shot_size": "MEDIUM",
        "camera_angle": "EYE_LEVEL",
        "camera_motion": "TRACKING"
      },
      "action_emotion": {
        "action": "connect clues and timeline",
        "emotion": "suspense"
      },
      "time_weather": {
        "time_of_day": "SUNSET",
        "weather": "CLOUDY"
      },
      "negative_constraints": [
        "explicit dismemberment details",
        "graphic torture description",
        "victim-blaming phrasing",
        "no explicit gore visuals",
        "avoid glorifying perpetrator"
      ],
      "visual_prompt": {
        "image_prompt": "true_crime_cinematic_pt_v2, high-contrast dramatic frame for scene_003. Create immediate scroll-stop impact around: Increase curiosity with evidence-driven progression.. Narration phrase: Registros e relatos mostraram uma contradicao na linha do tempo.. Location: location_primary. Shot: MEDIUM EYE_LEVEL. Character anchor: person_victim.",
        "video_prompt": "CameraMotion: TRACKING. Action: connect clues and timeline. Emotion: suspense. Start with a sharp visual reveal, then sustain suspense while preserving scene continuity."
      },
      "source_refs": [
        "clm_001"
      ]
    },
    {
      "scene_id": "scene_004",
      "beat_id": "beat_004",
      "duration_sec": 3.08,
      "narration_text": "A evidencia final mudou a leitura do caso.",
      "visual_goal": "Resolve contradiction with clear investigative framing.",
      "character_refs": [
        "person_victim"
      ],
      "location_ref": "location_primary",
      "continuity_state": {
        "scene_index": 4,
        "purpose": "payoff",
        "prompt_candidate_id": "scene_004_prompt_002",
        "prompt_strategy": "impact_focus",
        "prompt_revised": true
      },
      "shot_spec": {
        "shot_size": "CLOSEUP",
        "camera_angle": "HIGH_ANGLE",
        "camera_motion": "DOLLY"
      },
      "action_emotion": {
        "action": "confirm decisive evidence",
        "emotion": "grim clarity"
      },
      "time_weather": {
        "time_of_day": "NIGHT",
        "weather": "CLOUDY"
      },
      "negative_constraints": [
        "explicit dismemberment details",
        "graphic torture description",
        "victim-blaming phrasing",
        "no explicit gore visuals",
        "avoid glorifying perpetrator"
      ],
      "visual_prompt": {
        "image_prompt": "true_crime_cinematic_pt_v2, high-contrast dramatic frame for scene_004. Create immediate scroll-stop impact around: Resolve contradiction with clear investigative framing.. Narration phrase: A evidencia final mudou a leitura do caso.. Location: location_primary. Shot: CLOSEUP HIGH_ANGLE. Character anchor: person_victim.",
        "video_prompt": "CameraMotion: DOLLY. Action: confirm decisive evidence. Emotion: grim clarity. Start with a sharp visual reveal, then sustain suspense while preserving scene continuity."
      },
      "source_refs": [
        "clm_001"
      ]
    },
    {
      "scene_id": "scene_005",
      "beat_id": "beat_005",
      "duration_sec": 3.46,
      "narration_text": "Reveja a primeira frase e perceba o que mudou.",
      "visual_goal": "Create replay curiosity by mirroring the opening beat.",
      "character_refs": [
        "person_victim"
      ],
      "location_ref": "location_primary",
      "continuity_state": {
        "scene_index": 5,
        "purpose": "loop",
        "prompt_candidate_id": "scene_005_prompt_002",
        "prompt_strategy": "impact_focus",
        "prompt_revised": true
      },
      "shot_spec": {
        "shot_size": "EXTREME_CLOSEUP",
        "camera_angle": "DUTCH",
        "camera_motion": "STATIC"
      },
      "action_emotion": {
        "action": "echo opening line",
        "emotion": "curiosity"
      },
      "time_weather": {
        "time_of_day": "NIGHT",
        "weather": "CLOUDY"
      },
      "negative_constraints": [
        "explicit dismemberment details",
        "graphic torture description",
        "victim-blaming phrasing",
        "no explicit gore visuals",
        "avoid glorifying perpetrator"
      ],
      "visual_prompt": {
        "image_prompt": "true_crime_cinematic_pt_v2, high-contrast dramatic frame for scene_005. Create immediate scroll-stop impact around: Create replay curiosity by mirroring the opening beat.. Narration phrase: Reveja a primeira frase e perceba o que mudou.. Location: location_primary. Shot: EXTREME_CLOSEUP DUTCH. Character anchor: person_victim.",
        "video_prompt": "CameraMotion: STATIC. Action: echo opening line. Emotion: curiosity. Start with a sharp visual reveal, then sustain suspense while preserving scene continuity."
      },
      "source_refs": [
        "clm_001"
      ]
    }
  ]
}
